{
  "campaign_state": {
    "boundary_crossings": 1,
    "campaign_id": "campaign-001",
    "credential_events": 0,
    "denials": 0,
    "destinations": [
      "+15551234567"
    ],
    "encoded_fragments": 0,
    "last_sequence": 10,
    "quarantines": 0,
    "sessions": [
      "session-001"
    ],
    "status": "ACTIVE",
    "suspension_reason": null,
    "total_actions": 1,
    "trust_domains": [
      "sms-provider"
    ]
  },
  "decision": {
    "approval_digest": "sha256:1ba8ea53a5c09ac66793af18e980185d7bf6c14303e177a8f85d9cd189e49530",
    "campaign_state_digest": "sha256:37d4fc3cb04ba66ba6c47273b35e2eba389bd4068873df41b2c04e267e7d4356",
    "decided_at_seq": 10,
    "decision_id": "decision:proposal-001:10",
    "evidence_root": "sha256:5a690eecc64c3f87b2574331917b06a0c5675f804a72691d2b74f5f47e3f0349",
    "policy_digest": "sha256:e16c49408236bf51017556079c3d5d8f8e8b21bda0aa226e64b16570a2800b11",
    "prior_campaign_state_digest": "sha256:2f4dbcc4a0f3caca385502f4ecb40591134e0df2362fa95d9d60d551e0960823",
    "proposal_digest": "sha256:2bd0b3760f83a2581b69e36e335e38bf68135f58338e87b03e4d421175e7872c",
    "reason_codes": [
      "ALL_GATES_PASSED"
    ],
    "schema_version": "claimsieve.decision.v1",
    "trace_id": "trace-001",
    "verdict": "ALLOW"
  },
  "evidence": [
    {
      "content": {
        "consent": "lead-form",
        "phone": "+15551234567"
      },
      "issuer_key_id": "crm_evidence-key-v1",
      "observed_at_seq": 10,
      "schema_version": "claimsieve.evidence.v1",
      "signature": "ed25519:q87TIEu59znWTAH658vw-1WOejUdohjOnMgsGy3Zx2-Fn9PALQiq908VTxKppdj7cOxZ1jhnzBVcN4EYKzk5DA",
      "source": "spiffe://mainstreet.local/tenant-demo/crm-reader",
      "subject": "lead-123",
      "type": "customer_contact_authority",
      "verified": true
    },
    {
      "content": {
        "authority": "+15551234567",
        "trust_domain": "sms-provider"
      },
      "issuer_key_id": "registry_evidence-key-v1",
      "observed_at_seq": 10,
      "schema_version": "claimsieve.evidence.v1",
      "signature": "ed25519:41i6np2zq2w-n4Gyw3OpbfHSX3W6bA4vjL1sbcIQPB5e3p-uQ6a1P8pX5aIeOS7b6ygfSU6y7Qg2gU_7r8mRCw",
      "source": "spiffe://claimsieve.local/registry",
      "subject": "sms-provider",
      "type": "destination_registry",
      "verified": true
    },
    {
      "content": {
        "expires_at_seq": 100,
        "network_profile_digest": "sha256:cce5478dee12434ae609f7ba2dd3c39f4b0d8c3037ccdc66ac9eb150dcea05b9",
        "runtime_manifest_digest": "sha256:99b41347b32f0e016eaa4038f45095a73d9384d5a93a5af3e8d316e2f5285daf",
        "skills_manifest_digest": "sha256:4c265376d40a8fde3adff5a7d9124e93e181e17a1d4009a8ac66273e697450a1",
        "status": "ACTIVE",
        "valid_from_seq": 0
      },
      "issuer_key_id": "deployment_evidence-key-v1",
      "observed_at_seq": 10,
      "schema_version": "claimsieve.evidence.v1",
      "signature": "ed25519:K3lb9UyFAN0tmn9Qb0uN0fCeDWdd-1YlQ3yZ4T4wKToONbpPu9i0BvnvrQtypD_tm4a5vZ_CpwMGSqbTOeqaDQ",
      "source": "spiffe://claimsieve.local/deployment-certifier",
      "subject": "mainstreet-tenant-demo-deployment",
      "type": "deployment_certificate",
      "verified": true
    },
    {
      "content": {
        "deployment_certificate_digest": "sha256:d67c901640b2508f3276bef04889b33deb932c0b9c90aba43411d9e4cfe8f3f6",
        "policy_version": 2,
        "runtime_manifest_digest": "sha256:99b41347b32f0e016eaa4038f45095a73d9384d5a93a5af3e8d316e2f5285daf",
        "status": "ACTIVE"
      },
      "issuer_key_id": "epoch_evidence-key-v1",
      "observed_at_seq": 10,
      "schema_version": "claimsieve.evidence.v1",
      "signature": "ed25519:eg9YLE4dQ7JSL40sfRC3H6iOCu77jqNC3ZevRqTIeJogh54fkfkHFqKcaJQ_MN70PO8PowzKzsvMZo8HgkNyAA",
      "source": "spiffe://claimsieve.local/epoch-authority",
      "subject": "tenant-demo-epoch-2",
      "type": "governance_epoch",
      "verified": true
    }
  ],
  "ledgers": {
    "decision": [
      {
        "ledger_id": "decision",
        "payload": {
          "policy": {
            "allowed_action_kinds": [
              "send_message",
              "create_calendar_event",
              "fetch_artifact"
            ],
            "allowed_approver_identities": [
              "spiffe://mainstreet.local/tenant-demo/human/owner"
            ],
            "allowed_approver_key_ids": [
              "approver-key-v1"
            ],
            "allowed_effect_classes": [
              "read",
              "external_write",
              "network_boundary"
            ],
            "allowed_principals": [
              "spiffe://mainstreet.local/tenant-demo/agent/openclaw"
            ],
            "allowed_subgoals": [
              "respond_to_lead",
              "schedule_appointment",
              "retrieve_pinned_dependency"
            ],
            "allowed_trust_domains": [
              "tenant-demo",
              "sms-provider",
              "calendar-provider",
              "artifact-registry"
            ],
            "approval_required_for": [
              "external_write",
              "network_boundary",
              "create_calendar_event"
            ],
            "campaign_limits": {
              "max_actions": 20,
              "max_boundary_crossings": 4,
              "max_denials": 3,
              "max_encoded_fragments": 1,
              "max_new_destinations": 4,
              "max_sessions": 3
            },
            "deny_risk_tags": [
              "UNDECLARED_REDIRECT",
              "EXECUTABLE_UPLOAD",
              "PACKAGE_PROXY_TUNNEL"
            ],
            "freshness_window": 10,
            "policy_id": "mainstreet-demo-policy",
            "required_evidence": [
              "customer_contact_authority",
              "destination_registry",
              "deployment_certificate",
              "governance_epoch"
            ],
            "schema_version": "claimsieve.policy.v1",
            "suspend_risk_tags": [
              "DIRECT_EXECUTION_ATTEMPT",
              "CREDENTIAL_USE",
              "CLOUD_METADATA_ACCESS",
              "OBSERVER_TAMPER",
              "UNRESTRICTED_NESTED_AGENT"
            ],
            "tenant_id": "tenant-demo",
            "trusted_evidence_key_ids": {
              "customer_contact_authority": [
                "crm_evidence-key-v1"
              ],
              "deployment_certificate": [
                "deployment_evidence-key-v1"
              ],
              "destination_registry": [
                "registry_evidence-key-v1"
              ],
              "governance_epoch": [
                "epoch_evidence-key-v1"
              ]
            },
            "trusted_evidence_sources": {
              "customer_contact_authority": [
                "spiffe://mainstreet.local/tenant-demo/crm-reader"
              ],
              "deployment_certificate": [
                "spiffe://claimsieve.local/deployment-certifier"
              ],
              "destination_registry": [
                "spiffe://claimsieve.local/registry"
              ],
              "governance_epoch": [
                "spiffe://claimsieve.local/epoch-authority"
              ]
            },
            "version": 2
          },
          "schema_version": "claimsieve.signed_policy.v1",
          "signature": "ed25519:85d0NEzLPbEtgelyk58vvS80iIHJQaPYA9yrlurbmDpexlXtpu7aq_Ha0yyPS2XPS6e7RX4WGk1_Q1oPxNnICw",
          "signer_key_id": "policy_authority-key-v1"
        },
        "payload_hash": "sha256:8b32f76ab9046f8560ac4d479452b8f7dda7e112fae3fd9de1af5ce85df6a149",
        "previous_hash": "sha256:0000000000000000000000000000000000000000000000000000000000000000",
        "record_hash": "sha256:51fc2d9d83a07b3ffb9f2ddf84ad07cce88791897b3c8114f5becf60375c9135",
        "record_type": "SIGNED_POLICY_RECORDED",
        "schema_version": "claimsieve.ledger_record.v1",
        "sequence": 0,
        "signature": "ed25519:YEEvm-zii7Xa6sUBlrmc3akFZGXYgZGyhhzu2KHy44wblbbDpFBfluKx6t9OPnKNtokODfDGzJyVkxmw3uBNDw",
        "trace_id": "trace-001",
        "writer_key_id": "decision-key-v1"
      },
      {
        "ledger_id": "decision",
        "payload": {
          "approval_digest": "sha256:1ba8ea53a5c09ac66793af18e980185d7bf6c14303e177a8f85d9cd189e49530",
          "campaign_state_digest": "sha256:37d4fc3cb04ba66ba6c47273b35e2eba389bd4068873df41b2c04e267e7d4356",
          "decided_at_seq": 10,
          "decision_id": "decision:proposal-001:10",
          "evidence_root": "sha256:5a690eecc64c3f87b2574331917b06a0c5675f804a72691d2b74f5f47e3f0349",
          "policy_digest": "sha256:e16c49408236bf51017556079c3d5d8f8e8b21bda0aa226e64b16570a2800b11",
          "prior_campaign_state_digest": "sha256:2f4dbcc4a0f3caca385502f4ecb40591134e0df2362fa95d9d60d551e0960823",
          "proposal_digest": "sha256:2bd0b3760f83a2581b69e36e335e38bf68135f58338e87b03e4d421175e7872c",
          "reason_codes": [
            "ALL_GATES_PASSED"
          ],
          "schema_version": "claimsieve.decision.v1",
          "trace_id": "trace-001",
          "verdict": "ALLOW"
        },
        "payload_hash": "sha256:7939c54723b17c1197effb699658e095849befa4333597cb2ae62739a8576209",
        "previous_hash": "sha256:51fc2d9d83a07b3ffb9f2ddf84ad07cce88791897b3c8114f5becf60375c9135",
        "record_hash": "sha256:5e8dea9b696cbfecf5e45850ef4bd1adc834ea6b57febb8bbcfab6c0fe859911",
        "record_type": "DECISION_RECORDED",
        "schema_version": "claimsieve.ledger_record.v1",
        "sequence": 1,
        "signature": "ed25519:aN7S4cpZeF-_zbFsCCFPJv4Iz3lxOOX42NPdMnH6Yr9y7S2Bt6dLhoscmdY2vtszeMVo9GneuYm7w069YrjNBg",
        "trace_id": "trace-001",
        "writer_key_id": "decision-key-v1"
      },
      {
        "ledger_id": "decision",
        "payload": {
          "action_digest": "sha256:4f6650762d1f6c67271091ab8b05c5cb818cb47ab4db3c1a0dbd91ffcf176f06",